tests/matmul.log
{"input": ["cuda -keys=cuda,gpu -arch=sm_87 -max_num_threads=1024 -thread_warp_size=32", "matmul_cuda", [128, 128, 128], {}], "config": {"index": 2, "code_hash": null, "entity": [["tile_size", "ot", 64]]}, "result": [[0.0015048000000000001], 0, 0.9212117195129395, 1728235567.3876185], "version": 0.2, "tvm_version": "0.17.dev0"}
{"input": ["cuda -keys=cuda,gpu -arch=sm_87 -max_num_threads=1024 -thread_warp_size=32", "matmul_cuda", [128, 128, 128], {}], "config": {"index": 3, "code_hash": null, "entity": [["tile_size", "ot", 128]]}, "result": [[0.0017791488000000002], 0, 1.0240154266357422, 1728235567.8078592], "version": 0.2, "tvm_version": "0.17.dev0"}
{"input": ["cuda -keys=cuda,gpu -arch=sm_87 -max_num_threads=1024 -thread_warp_size=32", "matmul_cuda", [128, 128, 128], {}], "config": {"index": 1, "code_hash": null, "entity": [["tile_size", "ot", 32]]}, "result": [[0.000924179], 0, 0.9521393775939941, 1728235568.14606], "version": 0.2, "tvm_version": "0.17.dev0"}
{"input": ["cuda -keys=cuda,gpu -arch=sm_87 -max_num_threads=1024 -thread_warp_size=32", "matmul_cuda", [128, 128, 128], {}], "config": {"index": 0, "code_hash": null, "entity": [["tile_size", "ot", 16]]}, "result": [[0.0005128766], 0, 0.9259188175201416, 1728235568.474616], "version": 0.2, "tvm_version": "0.17.dev0"}
{"input": ["cuda -keys=cuda,gpu -arch=sm_87 -max_num_threads=1024 -thread_warp_size=32", "matmul_cuda", [128, 128, 128], {}], "config": {"index": 0, "code_hash": null, "entity": [["tile_size", "ot", 16]]}, "result": [[0.0005137216], 0, 0.9970793724060059, 1728235721.8454547], "version": 0.2, "tvm_version": "0.17.dev0"}
{"input": ["cuda -keys=cuda,gpu -arch=sm_87 -max_num_threads=1024 -thread_warp_size=32", "matmul_cuda", [128, 128, 128], {}], "config": {"index": 2, "code_hash": null, "entity": [["tile_size", "ot", 64]]}, "result": [[0.001503955], 0, 0.9528417587280273, 1728235722.1934347], "version": 0.2, "tvm_version": "0.17.dev0"}
{"input": ["cuda -keys=cuda,gpu -arch=sm_87 -max_num_threads=1024 -thread_warp_size=32", "matmul_cuda", [128, 128, 128], {}], "config": {"index": 3, "code_hash": null, "entity": [["tile_size", "ot", 128]]}, "result": [[0.0017769472000000001], 0, 0.955704927444458, 1728235722.5426817], "version": 0.2, "tvm_version": "0.17.dev0"}
{"input": ["cuda -keys=cuda,gpu -arch=sm_87 -max_num_threads=1024 -thread_warp_size=32", "matmul_cuda", [128, 128, 128], {}], "config": {"index": 1, "code_hash": null, "entity": [["tile_size", "ot", 32]]}, "result": [[0.0009246272], 0, 0.9882481098175049, 1728235722.9152832], "version": 0.2, "tvm_version": "0.17.dev0"}
{"input": ["cuda -keys=cuda,gpu -arch=sm_87 -max_num_threads=1024 -thread_warp_size=32", "matmul_cuda", [128, 128, 128], {}], "config": {"index": 1, "code_hash": null, "entity": [["tile_size", "ot", 32]]}, "result": [[0.00092416], 0, 0.9095010757446289, 1728235743.4684875], "version": 0.2, "tvm_version": "0.17.dev0"}
{"input": ["cuda -keys=cuda,gpu -arch=sm_87 -max_num_threads=1024 -thread_warp_size=32", "matmul_cuda", [128, 128, 128], {}], "config": {"index": 3, "code_hash": null, "entity": [["tile_size", "ot", 128]]}, "result": [[0.0017802878], 0, 1.054772138595581, 1728235743.9137592], "version": 0.2, "tvm_version": "0.17.dev0"}
{"input": ["cuda -keys=cuda,gpu -arch=sm_87 -max_num_threads=1024 -thread_warp_size=32", "matmul_cuda", [128, 128, 128], {}], "config": {"index": 2, "code_hash": null, "entity": [["tile_size", "ot", 64]]}, "result": [[0.0015046976], 0, 0.9618961811065674, 1728235744.2642035], "version": 0.2, "tvm_version": "0.17.dev0"}
{"input": ["cuda -keys=cuda,gpu -arch=sm_87 -max_num_threads=1024 -thread_warp_size=32", "matmul_cuda", [128, 128, 128], {}], "config": {"index": 0, "code_hash": null, "entity": [["tile_size", "ot", 16]]}, "result": [[0.0005151616], 0, 0.932945966720581, 1728235744.5940638], "version": 0.2, "tvm_version": "0.17.dev0"}
{"input": ["cuda -keys=cuda,gpu -arch=sm_87 -max_num_threads=1024 -thread_warp_size=32", "matmul_cuda", [128, 128, 128], {}], "config": {"index": 2, "code_hash": null, "entity": [["tile_size", "ot", 64]]}, "result": [[0.0015038462000000002], 0, 0.9210696220397949, 1728236479.5979545], "version": 0.2, "tvm_version": "0.17.dev0"}
{"input": ["cuda -keys=cuda,gpu -arch=sm_87 -max_num_threads=1024 -thread_warp_size=32", "matmul_cuda", [128, 128, 128], {}], "config": {"index": 1, "code_hash": null, "entity": [["tile_size", "ot", 32]]}, "result": [[0.0009242813999999998], 0, 0.9568090438842773, 1728236479.9367688], "version": 0.2, "tvm_version": "0.17.dev0"}
{"input": ["cuda -keys=cuda,gpu -arch=sm_87 -max_num_threads=1024 -thread_warp_size=32", "matmul_cuda", [128, 128, 128], {}], "config": {"index": 0, "code_hash": null, "entity": [["tile_size", "ot", 16]]}, "result": [[0.0005138494], 0, 0.9496979713439941, 1728236480.274249], "version": 0.2, "tvm_version": "0.17.dev0"}
{"input": ["cuda -keys=cuda,gpu -arch=sm_87 -max_num_threads=1024 -thread_warp_size=32", "matmul_cuda", [128, 128, 128], {}], "config": {"index": 3, "code_hash": null, "entity": [["tile_size", "ot", 128]]}, "result": [[0.0017780416], 0, 0.9627838134765625, 1728236480.6278348], "version": 0.2, "tvm_version": "0.17.dev0"}
{"input": ["cuda -keys=cuda,gpu -arch=sm_87 -max_num_threads=1024 -thread_warp_size=32", "matmul_cuda", [128, 128, 128], {}], "config": {"index": 2, "code_hash": null, "entity": [["tile_size", "ot", 64]]}, "result": [[0.001504307], 0, 0.9130914211273193, 1728301053.2698567], "version": 0.2, "tvm_version": "0.17.dev0"}
{"input": ["cuda -keys=cuda,gpu -arch=sm_87 -max_num_threads=1024 -thread_warp_size=32", "matmul_cuda", [128, 128, 128], {}], "config": {"index": 1, "code_hash": null, "entity": [["tile_size", "ot", 32]]}, "result": [[0.0009243328], 0, 0.9391722679138184, 1728301053.6098714], "version": 0.2, "tvm_version": "0.17.dev0"}
{"input": ["cuda -keys=cuda,gpu -arch=sm_87 -max_num_threads=1024 -thread_warp_size=32", "matmul_cuda", [128, 128, 128], {}], "config": {"index": 3, "code_hash": null, "entity": [["tile_size", "ot", 128]]}, "result": [[0.0017778111999999999], 0, 0.9533312320709229, 1728301053.9589355], "version": 0.2, "tvm_version": "0.17.dev0"}
{"input": ["cuda -keys=cuda,gpu -arch=sm_87 -max_num_threads=1024 -thread_warp_size=32", "matmul_cuda", [128, 128, 128], {}], "config": {"index": 0, "code_hash": null, "entity": [["tile_size", "ot", 16]]}, "result": [[0.0005130878], 0, 0.9440011978149414, 1728301054.2941568], "version": 0.2, "tvm_version": "0.17.dev0"}
{"input": ["cuda -keys=cuda,gpu -arch=sm_87 -max_num_threads=1024 -thread_warp_size=32", "matmul_cuda", [128, 128, 128], {}], "config": {"index": 3, "code_hash": null, "entity": [["tile_size", "ot", 128]]}, "result": [[0.001776083], 0, 0.919367790222168, 1728301157.4572663], "version": 0.2, "tvm_version": "0.17.dev0"}
{"input": ["cuda -keys=cuda,gpu -arch=sm_87 -max_num_threads=1024 -thread_warp_size=32", "matmul_cuda", [128, 128, 128], {}], "config": {"index": 1, "code_hash": null, "entity": [["tile_size", "ot", 32]]}, "result": [[0.0009242176000000002], 0, 1.0145130157470703, 1728301157.8851318], "version": 0.2, "tvm_version": "0.17.dev0"}
{"input": ["cuda -keys=cuda,gpu -arch=sm_87 -max_num_threads=1024 -thread_warp_size=32", "matmul_cuda", [128, 128, 128], {}], "config": {"index": 0, "code_hash": null, "entity": [["tile_size", "ot", 16]]}, "result": [[0.0005127808000000001], 0, 0.9335708618164062, 1728301158.2179718], "version": 0.2, "tvm_version": "0.17.dev0"}
{"input": ["cuda -keys=cuda,gpu -arch=sm_87 -max_num_threads=1024 -thread_warp_size=32", "matmul_cuda", [128, 128, 128], {}], "config": {"index": 2, "code_hash": null, "entity": [["tile_size", "ot", 64]]}, "result": [[0.0015043328], 0, 0.9403150081634521, 1728301158.5647268], "version": 0.2, "tvm_version": "0.17.dev0"}
{"input": ["cuda -keys=cuda,gpu -arch=sm_87 -max_num_threads=1024 -thread_warp_size=32", "matmul_cuda", [128, 128, 128], {}], "config": {"index": 1, "code_hash": null, "entity": [["tile_size", "ot", 32]]}, "result": [[0.0009241408], 0, 0.8984029293060303, 1728301185.4716733], "version": 0.2, "tvm_version": "0.17.dev0"}
{"input": ["cuda -keys=cuda,gpu -arch=sm_87 -max_num_threads=1024 -thread_warp_size=32", "matmul_cuda", [128, 128, 128], {}], "config": {"index": 2, "code_hash": null, "entity": [["tile_size", "ot", 64]]}, "result": [[0.0015039936000000001], 0, 1.0411386489868164, 1728301185.9172528], "version": 0.2, "tvm_version": "0.17.dev0"}
{"input": ["cuda -keys=cuda,gpu -arch=sm_87 -max_num_threads=1024 -thread_warp_size=32", "matmul_cuda", [128, 128, 128], {}], "config": {"index": 3, "code_hash": null, "entity": [["tile_size", "ot", 128]]}, "result": [[0.0017796990000000003], 0, 0.953157901763916, 1728301186.2694974], "version": 0.2, "tvm_version": "0.17.dev0"}
{"input": ["cuda -keys=cuda,gpu -arch=sm_87 -max_num_threads=1024 -thread_warp_size=32", "matmul_cuda", [128, 128, 128], {}], "config": {"index": 0, "code_hash": null, "entity": [["tile_size", "ot", 16]]}, "result": [[0.0005124414], 0, 0.9326856136322021, 1728301186.597931], "version": 0.2, "tvm_version": "0.17.dev0"}
{"input": ["cuda -keys=cuda,gpu -arch=sm_87 -max_num_threads=1024 -thread_warp_size=32", "matmul_cuda", [128, 128, 128], {}], "config": {"index": 0, "code_hash": null, "entity": [["tile_size", "ot", 16]]}, "result": [[0.0005133695999999999], 0, 0.9922876358032227, 1728301573.2406275], "version": 0.2, "tvm_version": "0.17.dev0"}
{"input": ["cuda -keys=cuda,gpu -arch=sm_87 -max_num_threads=1024 -thread_warp_size=32", "matmul_cuda", [128, 128, 128], {}], "config": {"index": 1, "code_hash": null, "entity": [["tile_size", "ot", 32]]}, "result": [[0.0009241408], 0, 0.933333158493042, 1728301573.5794601], "version": 0.2, "tvm_version": "0.17.dev0"}
{"input": ["cuda -keys=cuda,gpu -arch=sm_87 -max_num_threads=1024 -thread_warp_size=32", "matmul_cuda", [128, 128, 128], {}], "config": {"index": 2, "code_hash": null, "entity": [["tile_size", "ot", 64]]}, "result": [[0.0015043968], 0, 0.9453504085540771, 1728301573.9212925], "version": 0.2, "tvm_version": "0.17.dev0"}
{"input": ["cuda -keys=cuda,gpu -arch=sm_87 -max_num_threads=1024 -thread_warp_size=32", "matmul_cuda", [128, 128, 128], {}], "config": {"index": 3, "code_hash": null, "entity": [["tile_size", "ot", 128]]}, "result": [[0.0017734974], 0, 0.964576005935669, 1728301574.2905767], "version": 0.2, "tvm_version": "0.17.dev0"}
{"input": ["cuda -keys=cuda,gpu -arch=sm_87 -max_num_threads=1024 -thread_warp_size=32", "matmul_cuda", [128, 128, 128], {}], "config": {"index": 2, "code_hash": null, "entity": [["tile_size", "ot", 64]]}, "result": [[0.0015041536], 0, 0.9091320037841797, 1728301618.6411896], "version": 0.2, "tvm_version": "0.17.dev0"}
{"input": ["cuda -keys=cuda,gpu -arch=sm_87 -max_num_threads=1024 -thread_warp_size=32", "matmul_cuda", [128, 128, 128], {}], "config": {"index": 0, "code_hash": null, "entity": [["tile_size", "ot", 16]]}, "result": [[0.000513235], 0, 0.9222242832183838, 1728301618.9706967], "version": 0.2, "tvm_version": "0.17.dev0"}
{"input": ["cuda -keys=cuda,gpu -arch=sm_87 -max_num_threads=1024 -thread_warp_size=32", "matmul_cuda", [128, 128, 128], {}], "config": {"index": 1, "code_hash": null, "entity": [["tile_size", "ot", 32]]}, "result": [[0.0009242559999999998], 0, 0.9359085559844971, 1728301619.3122091], "version": 0.2, "tvm_version": "0.17.dev0"}
{"input": ["cuda -keys=cuda,gpu -arch=sm_87 -max_num_threads=1024 -thread_warp_size=32", "matmul_cuda", [128, 128, 128], {}], "config": {"index": 3, "code_hash": null, "entity": [["tile_size", "ot", 128]]}, "result": [[0.0017764736], 0, 0.9531505107879639, 1728301619.6671078], "version": 0.2, "tvm_version": "0.17.dev0"}
{"input": ["cuda -keys=cuda,gpu -arch=sm_87 -max_num_threads=1024 -thread_warp_size=32", "matmul_cuda", [128, 128, 128], {}], "config": {"index": 3, "code_hash": null, "entity": [["tile_size", "ot", 128]]}, "result": [[0.0017769472000000001], 0, 0.9980497360229492, 1728301667.2723582], "version": 0.2, "tvm_version": "0.17.dev0"}
{"input": ["cuda -keys=cuda,gpu -arch=sm_87 -max_num_threads=1024 -thread_warp_size=32", "matmul_cuda", [128, 128, 128], {}], "config": {"index": 0, "code_hash": null, "entity": [["tile_size", "ot", 16]]}, "result": [[0.0005129024], 0, 0.92447829246521, 1728301667.6004713], "version": 0.2, "tvm_version": "0.17.dev0"}
{"input": ["cuda -keys=cuda,gpu -arch=sm_87 -max_num_threads=1024 -thread_warp_size=32", "matmul_cuda", [128, 128, 128], {}], "config": {"index": 2, "code_hash": null, "entity": [["tile_size", "ot", 64]]}, "result": [[0.0015040511999999998], 0, 0.9484307765960693, 1728301667.952713], "version": 0.2, "tvm_version": "0.17.dev0"}
{"input": ["cuda -keys=cuda,gpu -arch=sm_87 -max_num_threads=1024 -thread_warp_size=32", "matmul_cuda", [128, 128, 128], {}], "config": {"index": 1, "code_hash": null, "entity": [["tile_size", "ot", 32]]}, "result": [[0.0009248318], 0, 0.998096227645874, 1728301668.3540924], "version": 0.2, "tvm_version": "0.17.dev0"}
{"input": ["cuda -keys=cuda,gpu -arch=sm_87 -max_num_threads=1024 -thread_warp_size=32", "matmul_cuda", [128, 128, 128], {}], "config": {"index": 3, "code_hash": null, "entity": [["tile_size", "ot", 128]]}, "result": [[0.0017791936], 0, 0.9841415882110596, 1728301860.4560616], "version": 0.2, "tvm_version": "0.17.dev0"}
{"input": ["cuda -keys=cuda,gpu -arch=sm_87 -max_num_threads=1024 -thread_warp_size=32", "matmul_cuda", [128, 128, 128], {}], "config": {"index": 2, "code_hash": null, "entity": [["tile_size", "ot", 64]]}, "result": [[0.0015037118], 0, 0.9486401081085205, 1728301860.801739], "version": 0.2, "tvm_version": "0.17.dev0"}
{"input": ["cuda -keys=cuda,gpu -arch=sm_87 -max_num_threads=1024 -thread_warp_size=32", "matmul_cuda", [128, 128, 128], {}], "config": {"index": 0, "code_hash": null, "entity": [["tile_size", "ot", 16]]}, "result": [[0.0005137022], 0, 0.9491355419158936, 1728301861.1380332], "version": 0.2, "tvm_version": "0.17.dev0"}
{"input": ["cuda -keys=cuda,gpu -arch=sm_87 -max_num_threads=1024 -thread_warp_size=32", "matmul_cuda", [128, 128, 128], {}], "config": {"index": 1, "code_hash": null, "entity": [["tile_size", "ot", 32]]}, "result": [[0.0009242813999999998], 0, 0.9832253456115723, 1728301861.5070233], "version": 0.2, "tvm_version": "0.17.dev0"}
{"input": ["cuda -keys=cuda,gpu -arch=sm_87 -max_num_threads=1024 -thread_warp_size=32", "matmul_cuda", [128, 128, 128], {}], "config": {"index": 0, "code_hash": null, "entity": [["tile_size", "ot", 16]]}, "result": [[0.0005134784], 0, 0.9056994915008545, 1728301892.7313988], "version": 0.2, "tvm_version": "0.17.dev0"}
{"input": ["cuda -keys=cuda,gpu -arch=sm_87 -max_num_threads=1024 -thread_warp_size=32", "matmul_cuda", [128, 128, 128], {}], "config": {"index": 3, "code_hash": null, "entity": [["tile_size", "ot", 128]]}, "result": [[0.001778144], 0, 0.9475197792053223, 1728301893.0861344], "version": 0.2, "tvm_version": "0.17.dev0"}
{"input": ["cuda -keys=cuda,gpu -arch=sm_87 -max_num_threads=1024 -thread_warp_size=32", "matmul_cuda", [128, 128, 128], {}], "config": {"index": 1, "code_hash": null, "entity": [["tile_size", "ot", 32]]}, "result": [[0.0009240896], 0, 1.0050275325775146, 1728301893.4978871], "version": 0.2, "tvm_version": "0.17.dev0"}
{"input": ["cuda -keys=cuda,gpu -arch=sm_87 -max_num_threads=1024 -thread_warp_size=32", "matmul_cuda", [128, 128, 128], {}], "config": {"index": 2, "code_hash": null, "entity": [["tile_size", "ot", 64]]}, "result": [[0.0015035008], 0, 0.9498984813690186, 1728301893.842702], "version": 0.2, "tvm_version": "0.17.dev0"}
{"input": ["cuda -keys=cuda,gpu -arch=sm_87 -max_num_threads=1024 -thread_warp_size=32", "matmul_cuda", [128, 128, 128], {}], "config": {"index": 3, "code_hash": null, "entity": [["tile_size", "ot", 128]]}, "result": [[0.0017796351999999997], 0, 0.9883692264556885, 1728302322.8221736], "version": 0.2, "tvm_version": "0.17.dev0"}
{"input": ["cuda -keys=cuda,gpu -arch=sm_87 -max_num_threads=1024 -thread_warp_size=32", "matmul_cuda", [128, 128, 128], {}], "config": {"index": 1, "code_hash": null, "entity": [["tile_size", "ot", 32]]}, "result": [[0.0009244733999999999], 0, 0.9408168792724609, 1728302323.1582818], "version": 0.2, "tvm_version": "0.17.dev0"}
{"input": ["cuda -keys=cuda,gpu -arch=sm_87 -max_num_threads=1024 -thread_warp_size=32", "matmul_cuda", [128, 128, 128], {}], "config": {"index": 0, "code_hash": null, "entity": [["tile_size", "ot", 16]]}, "result": [[0.0005166848], 0, 0.9427320957183838, 1728302323.4889126], "version": 0.2, "tvm_version": "0.17.dev0"}
{"input": ["cuda -keys=cuda,gpu -arch=sm_87 -max_num_threads=1024 -thread_warp_size=32", "matmul_cuda", [128, 128, 128], {}], "config": {"index": 2, "code_hash": null, "entity": [["tile_size", "ot", 64]]}, "result": [[0.001504576], 0, 1.0163459777832031, 1728302323.8845842], "version": 0.2, "tvm_version": "0.17.dev0"}
{"input": ["cuda -keys=cuda,gpu -arch=sm_87 -max_num_threads=1024 -thread_warp_size=32", "matmul_cuda", [128, 128, 128], {}], "config": {"index": 0, "code_hash": null, "entity": [["tile_size", "ot", 16]]}, "result": [[0.0005141822], 0, 0.8968029022216797, 1728302380.716288], "version": 0.2, "tvm_version": "0.17.dev0"}
{"input": ["cuda -keys=cuda,gpu -arch=sm_87 -max_num_threads=1024 -thread_warp_size=32", "matmul_cuda", [128, 128, 128], {}], "config": {"index": 2, "code_hash": null, "entity": [["tile_size", "ot", 64]]}, "result": [[0.0015043774], 0, 0.9488117694854736, 1728302381.0698614], "version": 0.2, "tvm_version": "0.17.dev0"}
{"input": ["cuda -keys=cuda,gpu -arch=sm_87 -max_num_threads=1024 -thread_warp_size=32", "matmul_cuda", [128, 128, 128], {}], "config": {"index": 1, "code_hash": null, "entity": [["tile_size", "ot", 32]]}, "result": [[0.0009245696000000001], 0, 0.934790849685669, 1728302381.409463], "version": 0.2, "tvm_version": "0.17.dev0"}
{"input": ["cuda -keys=cuda,gpu -arch=sm_87 -max_num_threads=1024 -thread_warp_size=32", "matmul_cuda", [128, 128, 128], {}], "config": {"index": 3, "code_hash": null, "entity": [["tile_size", "ot", 128]]}, "result": [[0.001775712], 0, 1.021362543106079, 1728302381.8356864], "version": 0.2, "tvm_version": "0.17.dev0"}
{"input": ["cuda -keys=cuda,gpu -arch=sm_87 -max_num_threads=1024 -thread_warp_size=32", "matmul_cuda", [128, 128, 128], {}], "config": {"index": 2, "code_hash": null, "entity": [["tile_size", "ot", 64]]}, "result": [[0.0015046336], 0, 0.9481887817382812, 1728302505.0236685], "version": 0.2, "tvm_version": "0.17.dev0"}
{"input": ["cuda -keys=cuda,gpu -arch=sm_87 -max_num_threads=1024 -thread_warp_size=32", "matmul_cuda", [128, 128, 128], {}], "config": {"index": 3, "code_hash": null, "entity": [["tile_size", "ot", 128]]}, "result": [[0.0017783614], 0, 0.945641040802002, 1728302505.3722298], "version": 0.2, "tvm_version": "0.17.dev0"}
{"input": ["cuda -keys=cuda,gpu -arch=sm_87 -max_num_threads=1024 -thread_warp_size=32", "matmul_cuda", [128, 128, 128], {}], "config": {"index": 1, "code_hash": null, "entity": [["tile_size", "ot", 32]]}, "result": [[0.0009244222], 0, 0.9396102428436279, 1728302505.7076232], "version": 0.2, "tvm_version": "0.17.dev0"}
{"input": ["cuda -keys=cuda,gpu -arch=sm_87 -max_num_threads=1024 -thread_warp_size=32", "matmul_cuda", [128, 128, 128], {}], "config": {"index": 0, "code_hash": null, "entity": [["tile_size", "ot", 16]]}, "result": [[0.0005155648000000001], 0, 0.931997537612915, 1728302506.0341952], "version": 0.2, "tvm_version": "0.17.dev0"}
{"input": ["cuda -keys=cuda,gpu -arch=sm_87 -max_num_threads=1024 -thread_warp_size=32", "matmul_cuda", [128, 128, 128], {}], "config": {"index": 0, "code_hash": null, "entity": [["tile_size", "ot", 16]]}, "result": [[0.0005137406], 0, 0.907073974609375, 1728302752.3825982], "version": 0.2, "tvm_version": "0.17.dev0"}
{"input": ["cuda -keys=cuda,gpu -arch=sm_87 -max_num_threads=1024 -thread_warp_size=32", "matmul_cuda", [128, 128, 128], {}], "config": {"index": 2, "code_hash": null, "entity": [["tile_size", "ot", 64]]}, "result": [[0.0015037758], 0, 0.941523551940918, 1728302752.727855], "version": 0.2, "tvm_version": "0.17.dev0"}
{"input": ["cuda -keys=cuda,gpu -arch=sm_87 -max_num_threads=1024 -thread_warp_size=32", "matmul_cuda", [128, 128, 128], {}], "config": {"index": 1, "code_hash": null, "entity": [["tile_size", "ot", 32]]}, "result": [[0.0009243454], 0, 1.028097152709961, 1728302753.1466806], "version": 0.2, "tvm_version": "0.17.dev0"}
{"input": ["cuda -keys=cuda,gpu -arch=sm_87 -max_num_threads=1024 -thread_warp_size=32", "matmul_cuda", [128, 128, 128], {}], "config": {"index": 3, "code_hash": null, "entity": [["tile_size", "ot", 128]]}, "result": [[0.0017787136000000001], 0, 0.9423823356628418, 1728302753.4940217], "version": 0.2, "tvm_version": "0.17.dev0"}
{"input": ["cuda -keys=cuda,gpu -arch=sm_87 -max_num_threads=1024 -thread_warp_size=32", "matmul_cuda", [128, 128, 128], {}], "config": {"index": 2, "code_hash": null, "entity": [["tile_size", "ot", 64]]}, "result": [[0.001504659], 0, 1.0040185451507568, 1728302895.2431114], "version": 0.2, "tvm_version": "0.17.dev0"}
{"input": ["cuda -keys=cuda,gpu -arch=sm_87 -max_num_threads=1024 -thread_warp_size=32", "matmul_cuda", [128, 128, 128], {}], "config": {"index": 1, "code_hash": null, "entity": [["tile_size", "ot", 32]]}, "result": [[0.0009244605999999999], 0, 0.9324119091033936, 1728302895.57935], "version": 0.2, "tvm_version": "0.17.dev0"}
{"input": ["cuda -keys=cuda,gpu -arch=sm_87 -max_num_threads=1024 -thread_warp_size=32", "matmul_cuda", [128, 128, 128], {}], "config": {"index": 0, "code_hash": null, "entity": [["tile_size", "ot", 16]]}, "result": [[0.0005126848], 0, 0.936234712600708, 1728302895.9082632], "version": 0.2, "tvm_version": "0.17.dev0"}
{"input": ["cuda -keys=cuda,gpu -arch=sm_87 -max_num_threads=1024 -thread_warp_size=32", "matmul_cuda", [128, 128, 128], {}], "config": {"index": 3, "code_hash": null, "entity": [["tile_size", "ot", 128]]}, "result": [[0.0017757888000000002], 0, 1.0234501361846924, 1728302896.3397522], "version": 0.2, "tvm_version": "0.17.dev0"}
{"input": ["cuda -keys=cuda,gpu -arch=sm_87 -max_num_threads=1024 -thread_warp_size=32", "matmul_cuda", [128, 128, 128], {}], "config": {"index": 3, "code_hash": null, "entity": [["tile_size", "ot", 128]]}, "result": [[0.0017787838], 0, 0.9104762077331543, 1728302931.551026], "version": 0.2, "tvm_version": "0.17.dev0"}
{"input": ["cuda -keys=cuda,gpu -arch=sm_87 -max_num_threads=1024 -thread_warp_size=32", "matmul_cuda", [128, 128, 128], {}], "config": {"index": 0, "code_hash": null, "entity": [["tile_size", "ot", 16]]}, "result": [[0.0005129342], 0, 0.9350628852844238, 1728302931.8785586], "version": 0.2, "tvm_version": "0.17.dev0"}
{"input": ["cuda -keys=cuda,gpu -arch=sm_87 -max_num_threads=1024 -thread_warp_size=32", "matmul_cuda", [128, 128, 128], {}], "config": {"index": 2, "code_hash": null, "entity": [["tile_size", "ot", 64]]}, "result": [[0.0015040254], 0, 1.0279107093811035, 1728302932.297999], "version": 0.2, "tvm_version": "0.17.dev0"}
{"input": ["cuda -keys=cuda,gpu -arch=sm_87 -max_num_threads=1024 -thread_warp_size=32", "matmul_cuda", [128, 128, 128], {}], "config": {"index": 1, "code_hash": null, "entity": [["tile_size", "ot", 32]]}, "result": [[0.0009242813999999998], 0, 0.9310717582702637, 1728302932.6369607], "version": 0.2, "tvm_version": "0.17.dev0"}
